{
  "$id": "https://adityarathi.com/schemas/kalshi-reliability.schema.json",
  "title": "Weather-model reliability summary",
  "description": "Generated from src/lib/kalshi-reliability.ts. Evaluation only: no profit, positions, sizes, or per-city / per-forecast detail.",
  "$schema": "https://json-schema.org/draft/2020-12/schema",
  "type": "object",
  "properties": {
    "schema_version": {
      "type": "number",
      "const": 1
    },
    "provenance": {
      "type": "string",
      "enum": [
        "fixture",
        "live"
      ]
    },
    "generated_at": {
      "type": "string",
      "format": "date-time",
      "pattern": "^(?:(?:\\d\\d[2468][048]|\\d\\d[13579][26]|\\d\\d0[48]|[02468][048]00|[13579][26]00)-02-29|\\d{4}-(?:(?:0[13578]|1[02])-(?:0[1-9]|[12]\\d|3[01])|(?:0[469]|11)-(?:0[1-9]|[12]\\d|30)|(?:02)-(?:0[1-9]|1\\d|2[0-8])))T(?:(?:[01]\\d|2[0-3]):[0-5]\\d:[0-5]\\d(?:\\.\\d+)?(?:Z|([+-](?:[01]\\d|2[0-3]):[0-5]\\d)))$"
    },
    "as_of": {
      "type": "string",
      "pattern": "^\\d{4}-\\d{2}-\\d{2}$"
    },
    "window": {
      "type": "object",
      "properties": {
        "start": {
          "type": "string",
          "pattern": "^\\d{4}-\\d{2}-\\d{2}$"
        },
        "end": {
          "type": "string",
          "pattern": "^\\d{4}-\\d{2}-\\d{2}$"
        }
      },
      "required": [
        "start",
        "end"
      ],
      "additionalProperties": false
    },
    "model_version": {
      "type": "string",
      "minLength": 1,
      "maxLength": 40
    },
    "n_settled_forecasts": {
      "type": "integer",
      "exclusiveMinimum": 0,
      "maximum": 9007199254740991
    },
    "city_days": {
      "type": "integer",
      "exclusiveMinimum": 0,
      "maximum": 9007199254740991
    },
    "corp_curve": {
      "minItems": 2,
      "maxItems": 100,
      "type": "array",
      "items": {
        "type": "object",
        "properties": {
          "x": {
            "type": "number",
            "minimum": 0,
            "maximum": 1
          },
          "y": {
            "type": "number",
            "minimum": 0,
            "maximum": 1
          },
          "lo": {
            "type": "number",
            "minimum": 0,
            "maximum": 1
          },
          "hi": {
            "type": "number",
            "minimum": 0,
            "maximum": 1
          }
        },
        "required": [
          "x",
          "y",
          "lo",
          "hi"
        ],
        "additionalProperties": false
      }
    },
    "histogram": {
      "minItems": 1,
      "maxItems": 20,
      "type": "array",
      "items": {
        "type": "object",
        "properties": {
          "edge": {
            "type": "number",
            "minimum": 0,
            "maximum": 1
          },
          "count": {
            "type": "integer",
            "minimum": 0,
            "maximum": 9007199254740991
          }
        },
        "required": [
          "edge",
          "count"
        ],
        "additionalProperties": false
      }
    },
    "scores": {
      "type": "object",
      "properties": {
        "brier": {
          "type": "object",
          "properties": {
            "value": {
              "type": "number",
              "minimum": 0,
              "maximum": 1
            },
            "ci": {
              "type": "array",
              "prefixItems": [
                {
                  "type": "number",
                  "minimum": 0,
                  "maximum": 1
                },
                {
                  "type": "number",
                  "minimum": 0,
                  "maximum": 1
                }
              ],
              "items": false,
              "minItems": 2,
              "maxItems": 2
            }
          },
          "required": [
            "value",
            "ci"
          ],
          "additionalProperties": false
        },
        "crps": {
          "type": "object",
          "properties": {
            "value": {
              "type": "number",
              "minimum": 0
            },
            "ci": {
              "type": "array",
              "prefixItems": [
                {
                  "type": "number",
                  "minimum": 0
                },
                {
                  "type": "number",
                  "minimum": 0
                }
              ],
              "items": false,
              "minItems": 2,
              "maxItems": 2
            }
          },
          "required": [
            "value",
            "ci"
          ],
          "additionalProperties": false
        },
        "log": {
          "type": "object",
          "properties": {
            "value": {
              "type": "number",
              "minimum": 0
            },
            "ci": {
              "type": "array",
              "prefixItems": [
                {
                  "type": "number",
                  "minimum": 0
                },
                {
                  "type": "number",
                  "minimum": 0
                }
              ],
              "items": false,
              "minItems": 2,
              "maxItems": 2
            }
          },
          "required": [
            "value",
            "ci"
          ],
          "additionalProperties": false
        }
      },
      "required": [
        "brier",
        "crps",
        "log"
      ],
      "additionalProperties": false
    },
    "skill_vs": {
      "type": "object",
      "properties": {
        "climatology": {
          "type": "object",
          "properties": {
            "value": {
              "type": "number",
              "maximum": 1
            },
            "ci": {
              "type": "array",
              "prefixItems": [
                {
                  "type": "number",
                  "maximum": 1
                },
                {
                  "type": "number",
                  "maximum": 1
                }
              ],
              "items": false,
              "minItems": 2,
              "maxItems": 2
            }
          },
          "required": [
            "value",
            "ci"
          ],
          "additionalProperties": false
        },
        "nwp_only": {
          "type": "object",
          "properties": {
            "value": {
              "type": "number",
              "maximum": 1
            },
            "ci": {
              "type": "array",
              "prefixItems": [
                {
                  "type": "number",
                  "maximum": 1
                },
                {
                  "type": "number",
                  "maximum": 1
                }
              ],
              "items": false,
              "minItems": 2,
              "maxItems": 2
            }
          },
          "required": [
            "value",
            "ci"
          ],
          "additionalProperties": false
        },
        "market_implied": {
          "type": "object",
          "properties": {
            "value": {
              "type": "number",
              "maximum": 1
            },
            "ci": {
              "type": "array",
              "prefixItems": [
                {
                  "type": "number",
                  "maximum": 1
                },
                {
                  "type": "number",
                  "maximum": 1
                }
              ],
              "items": false,
              "minItems": 2,
              "maxItems": 2
            }
          },
          "required": [
            "value",
            "ci"
          ],
          "additionalProperties": false
        }
      },
      "required": [
        "climatology",
        "nwp_only",
        "market_implied"
      ],
      "additionalProperties": false
    },
    "calibration": {
      "type": "object",
      "properties": {
        "smooth_ece": {
          "type": "object",
          "properties": {
            "value": {
              "type": "number",
              "minimum": 0,
              "maximum": 1
            },
            "ci": {
              "type": "array",
              "prefixItems": [
                {
                  "type": "number",
                  "minimum": 0,
                  "maximum": 1
                },
                {
                  "type": "number",
                  "minimum": 0,
                  "maximum": 1
                }
              ],
              "items": false,
              "minItems": 2,
              "maxItems": 2
            },
            "definition": {
              "type": "string",
              "minLength": 10,
              "maxLength": 300
            }
          },
          "required": [
            "value",
            "ci",
            "definition"
          ],
          "additionalProperties": false
        },
        "corp_decomposition": {
          "type": "object",
          "properties": {
            "mcb": {
              "type": "number",
              "minimum": 0
            },
            "dsc": {
              "type": "number",
              "minimum": 0
            },
            "unc": {
              "type": "number",
              "minimum": 0,
              "maximum": 0.25
            }
          },
          "required": [
            "mcb",
            "dsc",
            "unc"
          ],
          "additionalProperties": false
        }
      },
      "required": [
        "smooth_ece",
        "corp_decomposition"
      ],
      "additionalProperties": false
    },
    "bootstrap": {
      "type": "object",
      "properties": {
        "method": {
          "type": "string",
          "const": "block-by-date"
        },
        "resamples": {
          "type": "integer",
          "minimum": 100,
          "maximum": 9007199254740991
        }
      },
      "required": [
        "method",
        "resamples"
      ],
      "additionalProperties": false
    },
    "gate_status": {
      "type": "string",
      "enum": [
        "pass",
        "fail"
      ]
    },
    "tests": {
      "type": "object",
      "properties": {
        "count": {
          "type": "integer",
          "minimum": 0,
          "maximum": 9007199254740991
        },
        "commit": {
          "type": "string",
          "pattern": "^[0-9a-f]{7,40}$"
        }
      },
      "required": [
        "count",
        "commit"
      ],
      "additionalProperties": false
    }
  },
  "required": [
    "schema_version",
    "provenance",
    "generated_at",
    "as_of",
    "window",
    "model_version",
    "n_settled_forecasts",
    "city_days",
    "corp_curve",
    "histogram",
    "scores",
    "skill_vs",
    "calibration",
    "bootstrap",
    "gate_status",
    "tests"
  ],
  "additionalProperties": false
}
